<?xml version="1.0" encoding="UTF-8"?>
<forum id="newsmth" xmlns:xsi="http://www.w3.org/2001/XMLSchema-instance" xsi:noNamespaceSchemaLocation="schema/template.xsd">
	<sites>
		<site url="http://www.newsmth.net/bbssec.php"/>
	</sites>
	<sitemap>
		<vertex id="catalog" paging="catalog" outlink="true">
			<script xpath="//SCRIPT/text()"/>
			<pattern type="token" token="bbsboa"/>
		</vertex>
		<vertex id="board" paging="prev" outlink="true">
			<script xpath="//SCRIPT/text()"/>
			<pattern type="token" token="bbsdoc">
				<query-item key="key" query="board"/>
				<query-item key="page" query="page"/>
			</pattern>
		</vertex>
		<vertex id="article" paging="none" outlink="false">
			<pattern type="token" token="bbscon">
				<query-item key="id" query="id"/>
				<query-item key="boardId" query="bid"/>
			</pattern>
		</vertex>
	</sitemap>
</forum>
